{
  "@context": "https://linked.art/ns/v1/linked-art.json",
  "id": "https://linked.art/example/provenance/0",
  "type": "Activity",
  "_label": "Provenance Activity",
  "classified_as": [
    {
      "id": "http://vocab.getty.edu/aat/300055863",
      "type": "Type",
      "_label": "Provenance Activity"
    }
  ]
}